{
  "pack_key": "copy_fa",
  "version": 1,
  "pack_schema_version": 1,
  "locale": "fa",
  "min_app_version": "1.0.0",
  "entries": {
    "common.ok": "باشه",
    "common.cancel": "بی‌خیال",
    "common.save": "ذخیره",
    "common.close": "بستن",
    "common.retry": "دوباره امتحان کن",
    "common.next": "بعدی",
    "common.back": "برگشت",
    "common.skip": "فعلاً نه",
    "common.done": "تموم شد",
    "common.continue": "ادامه",
    "common.start": "شروع",
    "error.generic": "یه مشکلی پیش اومد. دوباره امتحان کن.",
    "error.offline": "اینترنت نداری، ولی نگران نباش؛ چیزی از دست نمی‌ره.",
    "error.market": "مارکت جواب نداد. پولی کم نشده؛ یه کم بعد دوباره امتحان کن.",
    "error.purchase_claimed": "این خرید روی حساب دیگه‌ای ثبت شده. اگه فکر می‌کنی اشتباهه، با ما تماس بگیر.",
    "home.greeting.morning": [
      "صبح بخیر! {CAT_NAME} تازه بیدار شده.",
      "سلام صبح‌بخیر، چایی آماده‌ست؟"
    ],
    "home.greeting.afternoon": [
      "ظهر بخیر! {CAT_NAME} یه گوشه لم داده.",
      "سلام! یه استراحت کوچیک چطوره؟"
    ],
    "home.greeting.evening": [
      "عصر بخیر! {CAT_NAME} منتظر تعریف امروزته.",
      "سلام! امروز چطور گذشت؟"
    ],
    "home.greeting.night": [
      "شب بخیر. {CAT_NAME} خوابش می‌آد.",
      "شبت آروم. هر وقت خواستی، همین‌جاییم."
    ],
    "home.checkin_cta": "چک‌این امروز",
    "home.habits.title": "عادت‌های امروز",
    "home.habits.progress": "{n} تا انجام شد",
    "home.empty_habits.title": "هنوز عادتی نداری",
    "home.empty_habits.body": "با یه کار کوچیک شروع کن. مثلاً یه لیوان آب.",
    "home.adventure_away": "{CAT_NAME} رفته {place}. زود برمی‌گرده.",
    "home.trial_banner": "فردا دوره رایگان تموم می‌شه. هر چی خواستی، بدون فشار.",
    "checkin.title": "چک‌این",
    "checkin.prompt": "امروز چه حالی داری؟",
    "checkin.mood.1": "خیلی بد",
    "checkin.mood.2": "بد",
    "checkin.mood.3": "معمولی",
    "checkin.mood.4": "خوب",
    "checkin.mood.5": "عالی",
    "checkin.note.hint": "یه خط بنویس، اگه دلت خواست",
    "checkin.done": [
      "ثبت شد. ممنون که به خودت سر زدی.",
      "دمت گرم که یه لحظه برای خودت وایسادی."
    ],
    "checkin.low_mood_card": "اگه دوست داری با یکی حرف بزنی، من اینجام که راه رو نشونت بدم.",
    "checkin.low_mood_card.action": "ببینم",
    "habit.template.water.title": "آب خوردن",
    "habit.template.sleep.title": "خواب",
    "habit.template.short_break.title": "استراحت کوتاه",
    "habit.template.walk.title": "پیاده‌روی",
    "habit.template.healthy_food.title": "غذای مناسب",
    "habit.template.medicine.title": "یادآوری دارو",
    "habit.template.loved_ones.title": "وقت با آدم‌های مهم",
    "habit.add.title": "عادت جدید",
    "habit.custom.title": "عادت دلخواه",
    "habit.custom.name_hint": "اسمش رو بنویس",
    "habit.reminder.label": "یادآوری",
    "habit.completed": [
      "آفرین!",
      "یه قدم کوچیک، یه قدم خوب.",
      "{CAT_NAME} خوشحاله."
    ],
    "habit.limit.title": "جا برای عادت‌های بیشتر",
    "habit.limit.body": "با پریمیوم می‌تونی هر چند تا عادت که خواستی داشته باشی.",
    "habit.locked.hint": "این عادت فعلاً فقط خوندنیه.",
    "habit.undo": "برگردون",
    "exercise.list.title": "تمرین‌ها",
    "exercise.breathing_basic.name": "تنفس آروم",
    "exercise.gratitude.name": "شکرگزاری",
    "exercise.guided_journal.name": "یادداشت راهنما",
    "exercise.muscle_relax.name": "شل کردن عضله‌ها",
    "exercise.afternoon_tea.name": "چای عصرگاهی",
    "exercise.breathing_basic.step.intro": "راحت بشین. شونه‌هات رو شل کن.",
    "exercise.breathing_basic.step.inhale": "نفس بکش تو…",
    "exercise.breathing_basic.step.hold": "نگه دار…",
    "exercise.breathing_basic.step.exhale": "آروم بده بیرون…",
    "exercise.breathing_basic.step.outro": "همین‌طور آروم. خیلی خوب بود.",
    "exercise.gratitude.prompt.1": "امروز چه چیز کوچیکی باعث شد لبخند بزنی؟",
    "exercise.gratitude.prompt.2": "کی یا چی کمکت کرد؟",
    "exercise.gratitude.prompt.3": "چه چیزی از امروزت رو دوست داشتی؟",
    "exercise.guided_journal.prompt.1": "الان چه حسی تو بدنت هست؟",
    "exercise.guided_journal.prompt.2": "امروز چی بیشتر ذهنت رو مشغول کرد؟",
    "exercise.guided_journal.prompt.3": "یه چیزی که ازش خوشحالی بنویس.",
    "exercise.guided_journal.prompt.4": "اگه می‌تونستی به خودت یه توصیه بدی، چی بود؟",
    "exercise.guided_journal.prompt.5": "فردا دوست داری چه کار کوچیکی برای خودت بکنی؟",
    "exercise.muscle_relax.step.intro": "راحت بشین و چشم‌هات رو ببند.",
    "exercise.muscle_relax.step.hands": "مشت‌هات رو سفت کن، بعد ول کن.",
    "exercise.muscle_relax.step.shoulders": "شونه‌هات رو بالا بیار، بعد بنداز پایین.",
    "exercise.muscle_relax.step.face": "صورتت رو جمع کن، بعد شل کن.",
    "exercise.muscle_relax.step.legs": "پنجه‌های پات رو جمع کن، بعد رها کن.",
    "exercise.muscle_relax.step.release": "نفس عمیق بکش و همه‌چیز رو رها کن.",
    "exercise.muscle_relax.step.outro": "آروم چشم‌هات رو باز کن.",
    "exercise.afternoon_tea.step.intro": "یه استکان چای بردار؛ اگه نداری، تصورش کن.",
    "exercise.afternoon_tea.step.hold_glass": "گرمای استکان رو تو دستت حس کن.",
    "exercise.afternoon_tea.step.sip": "یه جرعه کوچیک بخور و عطرش رو نفس بکش.",
    "exercise.afternoon_tea.step.breathe": "آروم نفس بکش و صدای اطرافت رو بشنو.",
    "exercise.afternoon_tea.step.notice": "ببین الان چه حسی داری. بدون قضاوت.",
    "exercise.afternoon_tea.step.outro": "ممنون که یه کم مکث کردی.",
    "exercise.finish": "تموم شد. {CAT_NAME} هم لذت برد.",
    "disclaimer.exercise": "این تمرین جایگزین کمک تخصصی نیست.",
    "adventure.title": "ماجراجویی",
    "adventure.start": "بفرستش",
    "adventure.claim": "ببین چی آورده",
    "adventure.away": "{CAT_NAME} رفته {place}.",
    "adventure.returned": "{CAT_NAME} از گشت برگشت و برات چیزی آورده!",
    "adventure.not_enough_energy": "انرژی کم داریم؛ با یه عادت یا چک‌این پر می‌شه.",
    "adventure.location.alley.name": "کوچه",
    "adventure.location.rooftop.name": "پشت‌بام",
    "adventure.location.courtyard.name": "حیاط حوض‌دار",
    "adventure.location.bazaar.name": "بازار",
    "adventure.location.garden.name": "باغ",
    "adventure.story.alley.1": "{CAT_NAME} با یه گربه کوچه‌ای رفیق شد.",
    "adventure.story.alley.2": "یه سایه‌ی خنک پیدا کرد و کمی چرت زد.",
    "adventure.story.alley.3": "بوی نون تازه رو دنبال کرد.",
    "adventure.story.rooftop.1": "{CAT_NAME} غروب رو از پشت‌بام تماشا کرد.",
    "adventure.story.rooftop.2": "یه کبوتر کنجکاو رو دید.",
    "adventure.story.rooftop.3": "آسمون پر از ستاره بود.",
    "adventure.story.courtyard.1": "کنار حوض نشست و ماهی‌ها رو دید.",
    "adventure.story.courtyard.2": "یه برگ خشک رو دنبال کرد.",
    "adventure.story.courtyard.3": "صدای آب آرومش کرد.",
    "adventure.story.bazaar.1": "بین دکه‌ها گشت و بوی زعفرون رو حس کرد.",
    "adventure.story.bazaar.2": "یه فروشنده بهش یه تیکه نون داد.",
    "adventure.story.bazaar.3": "از پرسه‌زدن تو راسته‌ها خوشش اومد.",
    "adventure.story.garden.1": "بین گل‌ها قدم زد.",
    "adventure.story.garden.2": "یه پروانه رو تا آخر باغ دنبال کرد.",
    "adventure.story.garden.3": "زیر درخت آروم گرفت.",
    "shop.title": "فروشگاه",
    "shop.buy": "بخر",
    "shop.equip": "بپوشون",
    "shop.unequip": "دربیار",
    "shop.owned": "داری",
    "shop.not_enough_coins": "سکه‌ات کمه؛ با ماجراجویی جمع می‌شه.",
    "shop.premium_only": "ویژه‌ی پریمیوم",
    "shop.item.collar_turquoise.name": "گردنبند فیروزه‌ای",
    "shop.item.collar_red.name": "گردنبند قرمز",
    "shop.item.hat_beanie.name": "کلاه بافتنی",
    "shop.item.hat_flower.name": "کلاه گل‌دار",
    "shop.item.bg_alley_evening.name": "کوچه‌ی عصرگاهی",
    "shop.item.bg_rooftop_night.name": "پشت‌بام شب",
    "shop.item.bg_garden_spring.name": "باغ بهاری",
    "shop.item.samovar.name": "سماور",
    "shop.item.tea_glass.name": "استکان چای",
    "shop.item.rug_small.name": "فرش کوچیک",
    "shop.item.blanket_floral.name": "پتوی گل‌دار",
    "shop.item.pillow_cozy.name": "پشتی نرم",
    "streak.title": "پشت‌سرهم",
    "streak.continue": "{n} روز پشت سر هم!",
    "streak.reset": "از نو شروع می‌کنیم، {CAT_NAME} همین‌جاست.",
    "streak.freeze_used": "یه روز بخشش خرج شد؛ رشته‌ات سر جاشه.",
    "stats.title": "آمار",
    "stats.week": "این هفته",
    "stats.month": "این ماه",
    "stats.locked": "آمار عمیق‌تر با پریمیوم.",
    "notif.morning": [
      "صبح بخیر! {CAT_NAME} بیدار شده و منتظره.",
      "سلام! امروز چه حالی داری؟"
    ],
    "notif.morning.title": "صبح بخیر",
    "notif.habit_reminder.generic": [
      "{habit}؟ یه کار کوچیک، یه حال خوب.",
      "وقتشه: {habit}. {CAT_NAME} هم منتظره."
    ],
    "notif.habit_reminder.water": [
      "یه لیوان آب بد نیست، نه؟ {CAT_NAME} هم تشنه‌ست."
    ],
    "notif.habit_reminder.title": "یادآوری مهربون",
    "notif.evening_checkin": [
      "یه نفس عمیق بکش. امروز چطور گذشت؟"
    ],
    "notif.evening_checkin.title": "چک‌این عصر",
    "notif.cat_returned": [
      "{CAT_NAME} از گشت برگشت و برات چیزی آورده!"
    ],
    "notif.cat_returned.title": "{CAT_NAME} برگشت",
    "notif.streak_gentle": [
      "امروز هنوز سر نزدی. اگه یه دقیقه وقت داری، {CAT_NAME} خوشحال می‌شه."
    ],
    "notif.streak_gentle.title": "یه سر بزن",
    "notif.comeback.3": [
      "دلمون برات تنگ شده بود. هر وقت آماده‌ای، همین‌جاییم."
    ],
    "notif.comeback.7": [
      "{CAT_NAME} هنوز منتظره. هر وقت دلت خواست."
    ],
    "notif.comeback.14": [
      "یه سلام کوچیک از {CAT_NAME}. بدون هیچ فشاری."
    ],
    "notif.comeback.title": "سلام دوباره",
    "notif.trial.6": [
      "فردا دوره رایگان تموم می‌شه. هر چی خواستی، بدون فشار."
    ],
    "notif.trial.7": [
      "دوره رایگانت امروز تموم می‌شه. ممنون که امتحانش کردی."
    ],
    "notif.trial.title": "درباره‌ی دوره رایگان",
    "paywall.title": "{APP_NAME} پریمیوم",
    "paywall.subtitle": "هر چی خواستی، بدون فشار.",
    "paywall.benefit.habits": "عادت نامحدود و دلخواه",
    "paywall.benefit.exercises": "همه‌ی تمرین‌ها",
    "paywall.benefit.stats": "آمار و الگوها",
    "paywall.benefit.adventures": "ماجراجویی‌های ویژه",
    "paywall.benefit.items": "ظاهرها و پس‌زمینه‌های اختصاصی",
    "paywall.plan.premium_1m": "ماهانه",
    "paywall.plan.premium_3m": "۳ ماهه",